{
  "$schema": "../../schemas/setting.schema.json",
  "schema_version": "0.4.0",
  "id": "ps1650.psalm-063.primary.setting.auld-lang-syne",
  "psalm_id": "ps1650.psalm-063.primary",
  "tune_id": "ps1650.tune.auld-lang-syne",
  "lead_in": "satb",
  "inter_stanza_ticks": 960,
  "stanzas": [
    {
      "stanza_id": "ps1650.psalm-063.primary.stanza-01",
      "lines": [
        {
          "line_id": "ps1650.psalm-063.primary.stanza-01.line-01",
          "phrase_id": "ps1650.tune.auld-lang-syne.phrase-01",
          "tokens": [
            {
              "id": "ps1650.psalm-063.primary.stanza-01.line-01.token-01",
              "text": "Lord,",
              "syllables": 1,
              "note_ids": [
                "ps1650.tune.auld-lang-syne.phrase-01.note-01"
              ],
              "syllable_map": [
                {
                  "id": "ps1650.psalm-063.primary.stanza-01.line-01.token-01.syllable-01",
                  "text": "Lord,",
                  "note_ids": [
                    "ps1650.tune.auld-lang-syne.phrase-01.note-01"
                  ]
                }
              ]
            },
            {
              "id": "ps1650.psalm-063.primary.stanza-01.line-01.token-02",
              "text": "thee",
              "syllables": 1,
              "note_ids": [
                "ps1650.tune.auld-lang-syne.phrase-01.note-02"
              ],
              "syllable_map": [
                {
                  "id": "ps1650.psalm-063.primary.stanza-01.line-01.token-02.syllable-01",
                  "text": "thee",
                  "note_ids": [
                    "ps1650.tune.auld-lang-syne.phrase-01.note-02"
                  ]
                }
              ]
            },
            {
              "id": "ps1650.psalm-063.primary.stanza-01.line-01.token-03",
              "text": "my",
              "syllables": 1,
              "note_ids": [
                "ps1650.tune.auld-lang-syne.phrase-01.note-03"
              ],
              "syllable_map": [
                {
                  "id": "ps1650.psalm-063.primary.stanza-01.line-01.token-03.syllable-01",
                  "text": "my",
                  "note_ids": [
                    "ps1650.tune.auld-lang-syne.phrase-01.note-03"
                  ]
                }
              ]
            },
            {
              "id": "ps1650.psalm-063.primary.stanza-01.line-01.token-04",
              "text": "God,",
              "syllables": 1,
              "note_ids": [
                "ps1650.tune.auld-lang-syne.phrase-01.note-04"
              ],
              "syllable_map": [
                {
                  "id": "ps1650.psalm-063.primary.stanza-01.line-01.token-04.syllable-01",
                  "text": "God,",
                  "note_ids": [
                    "ps1650.tune.auld-lang-syne.phrase-01.note-04"
                  ]
                }
              ]
            },
            {
              "id": "ps1650.psalm-063.primary.stanza-01.line-01.token-05",
              "text": "I’ll",
              "syllables": 1,
              "note_ids": [
                "ps1650.tune.auld-lang-syne.phrase-01.note-05"
              ],
              "syllable_map": [
                {
                  "id": "ps1650.psalm-063.primary.stanza-01.line-01.token-05.syllable-01",
                  "text": "I’ll",
                  "note_ids": [
                    "ps1650.tune.auld-lang-syne.phrase-01.note-05"
                  ]
                }
              ]
            },
            {
              "id": "ps1650.psalm-063.primary.stanza-01.line-01.token-06",
              "text": "early",
              "syllables": 2,
              "note_ids": [
                "ps1650.tune.auld-lang-syne.phrase-01.note-06",
                "ps1650.tune.auld-lang-syne.phrase-01.note-07"
              ],
              "syllable_map": [
                {
                  "id": "ps1650.psalm-063.primary.stanza-01.line-01.token-06.syllable-01",
                  "text": "ear",
                  "note_ids": [
                    "ps1650.tune.auld-lang-syne.phrase-01.note-06"
                  ]
                },
                {
                  "id": "ps1650.psalm-063.primary.stanza-01.line-01.token-06.syllable-02",
                  "text": "ly",
                  "note_ids": [
                    "ps1650.tune.auld-lang-syne.phrase-01.note-07"
                  ]
                }
              ]
            },
            {
              "id": "ps1650.psalm-063.primary.stanza-01.line-01.token-07",
              "text": "seek:",
              "syllables": 1,
              "note_ids": [
                "ps1650.tune.auld-lang-syne.phrase-01.note-08"
              ],
              "syllable_map": [
                {
                  "id": "ps1650.psalm-063.primary.stanza-01.line-01.token-07.syllable-01",
                  "text": "seek:",
                  "note_ids": [
                    "ps1650.tune.auld-lang-syne.phrase-01.note-08"
                  ]
                }
              ]
            }
          ]
        },
        {
          "line_id": "ps1650.psalm-063.primary.stanza-01.line-02",
          "phrase_id": "ps1650.tune.auld-lang-syne.phrase-02",
          "tokens": [
            {
              "id": "ps1650.psalm-063.primary.stanza-01.line-02.token-01",
              "text": "my",
              "syllables": 1,
              "note_ids": [
                "ps1650.tune.auld-lang-syne.phrase-02.note-01",
                "ps1650.tune.auld-lang-syne.phrase-02.note-02"
              ],
              "syllable_map": [
                {
                  "id": "ps1650.psalm-063.primary.stanza-01.line-02.token-01.syllable-01",
                  "text": "my",
                  "note_ids": [
                    "ps1650.tune.auld-lang-syne.phrase-02.note-01",
                    "ps1650.tune.auld-lang-syne.phrase-02.note-02"
                  ]
                }
              ]
            },
            {
              "id": "ps1650.psalm-063.primary.stanza-01.line-02.token-02",
              "text": "soul",
              "syllables": 1,
              "note_ids": [
                "ps1650.tune.auld-lang-syne.phrase-02.note-03"
              ],
              "syllable_map": [
                {
                  "id": "ps1650.psalm-063.primary.stanza-01.line-02.token-02.syllable-01",
                  "text": "soul",
                  "note_ids": [
                    "ps1650.tune.auld-lang-syne.phrase-02.note-03"
                  ]
                }
              ]
            },
            {
              "id": "ps1650.psalm-063.primary.stanza-01.line-02.token-03",
              "text": "doth",
              "syllables": 1,
              "note_ids": [
                "ps1650.tune.auld-lang-syne.phrase-02.note-04"
              ],
              "syllable_map": [
                {
                  "id": "ps1650.psalm-063.primary.stanza-01.line-02.token-03.syllable-01",
                  "text": "doth",
                  "note_ids": [
                    "ps1650.tune.auld-lang-syne.phrase-02.note-04"
                  ]
                }
              ]
            },
            {
              "id": "ps1650.psalm-063.primary.stanza-01.line-02.token-04",
              "text": "thirst",
              "syllables": 1,
              "note_ids": [
                "ps1650.tune.auld-lang-syne.phrase-02.note-05"
              ],
              "syllable_map": [
                {
                  "id": "ps1650.psalm-063.primary.stanza-01.line-02.token-04.syllable-01",
                  "text": "thirst",
                  "note_ids": [
                    "ps1650.tune.auld-lang-syne.phrase-02.note-05"
                  ]
                }
              ]
            },
            {
              "id": "ps1650.psalm-063.primary.stanza-01.line-02.token-05",
              "text": "for",
              "syllables": 1,
              "note_ids": [
                "ps1650.tune.auld-lang-syne.phrase-02.note-06"
              ],
              "syllable_map": [
                {
                  "id": "ps1650.psalm-063.primary.stanza-01.line-02.token-05.syllable-01",
                  "text": "for",
                  "note_ids": [
                    "ps1650.tune.auld-lang-syne.phrase-02.note-06"
                  ]
                }
              ]
            },
            {
              "id": "ps1650.psalm-063.primary.stanza-01.line-02.token-06",
              "text": "thee;",
              "syllables": 1,
              "note_ids": [
                "ps1650.tune.auld-lang-syne.phrase-02.note-07"
              ],
              "syllable_map": [
                {
                  "id": "ps1650.psalm-063.primary.stanza-01.line-02.token-06.syllable-01",
                  "text": "thee;",
                  "note_ids": [
                    "ps1650.tune.auld-lang-syne.phrase-02.note-07"
                  ]
                }
              ]
            }
          ]
        },
        {
          "line_id": "ps1650.psalm-063.primary.stanza-01.line-03",
          "phrase_id": "ps1650.tune.auld-lang-syne.phrase-03",
          "tokens": [
            {
              "id": "ps1650.psalm-063.primary.stanza-01.line-03.token-01",
              "text": "My",
              "syllables": 1,
              "note_ids": [
                "ps1650.tune.auld-lang-syne.phrase-03.note-01"
              ],
              "syllable_map": [
                {
                  "id": "ps1650.psalm-063.primary.stanza-01.line-03.token-01.syllable-01",
                  "text": "My",
                  "note_ids": [
                    "ps1650.tune.auld-lang-syne.phrase-03.note-01"
                  ]
                }
              ]
            },
            {
              "id": "ps1650.psalm-063.primary.stanza-01.line-03.token-02",
              "text": "flesh",
              "syllables": 1,
              "note_ids": [